{
  "milestone": 6,
  "title": "API data product",
  "hours": 16,
  "project": "Learner-selected API idea",
  "mentorGate": false,
  "context": "Build the one approved API workflow and prove it handles real network and provider behavior without leaking credentials or confusing the user.",
  "stories": [
    {
      "id": "SWAI-401", "type": "story", "priority": "P0", "epic": "API product release", "title": "Implement the server-side provider adapter", "persona": "Developer", "outcome": "Provider behavior is isolated behind a validated internal contract.", "context": "The browser must not receive provider credentials or provider-specific response complexity.",
      "acceptanceCriteria": ["Server adapter constructs requests and handles timeout and non-success status", "Runtime validation rejects malformed provider data", "Provider response is mapped to the milestone 5 normalized type", "Unit tests use synthetic fixtures and make no paid network calls"],
      "designRefs": [], "dataContract": "Use the approved normalized contract from SWAI-304.",
      "expectations": {"security": "Credential is server-only and redacted from errors.", "privacy": "Return only fields required by the UI.", "accessibility": "Adapter errors map to actionable UI categories.", "analytics": "Track duration/status category without payload content."},
      "dependencies": ["SWAI-304"], "nonGoals": ["Supporting a second provider"], "definitionOfDone": ["Fixture tests cover success, empty, malformed, 401, 429, timeout, outage"], "evidence": ["Test output", "Adapter explanation"], "concepts": ["async", "fetch", "runtime validation", "type", "adapter"]
    },
    {
      "id": "SWAI-402", "type": "story", "priority": "P0", "epic": "API product release", "title": "Build the primary dashboard workflow", "persona": "Target user", "outcome": "The user can make the decision identified in milestone 5 using current, understandable data.", "context": "Implement the approved flow with URL/shareable state where appropriate and without speculative secondary features.",
      "acceptanceCriteria": ["Initial, loading, result, empty, stale, partial, and error states are intentionally designed", "Filters or pagination remain keyboard accessible and preserve understandable URL state", "Data freshness and source are visible", "Mobile and desktop layouts preserve the primary decision"],
      "designRefs": ["Learner-created user flow and wireframe"], "dataContract": "Consumes normalized adapter output only.",
      "expectations": {"security": "No direct browser call requiring secret.", "privacy": "Do not persist query data beyond the declared need.", "accessibility": "Status announcements, labels, focus, non-color meaning.", "analytics": "Track workflow completion and error category only."},
      "dependencies": ["SWAI-401"], "nonGoals": ["Admin portal", "Provider-specific debug UI"], "definitionOfDone": ["Critical browser journey passes", "Vercel preview works"], "evidence": ["State screenshots", "Preview URL", "User-flow trace"], "concepts": ["server component", "client state", "URL state", "loading", "pagination"]
    },
    {
      "id": "SWAI-403", "type": "bug", "priority": "P0", "epic": "API product release", "title": "Prevent failed responses from becoming cached data", "persona": "QA analyst", "outcome": "A provider failure cannot appear as a valid stale success.", "context": "QA observed that a failed response is normalized to an empty array and cached, hiding the outage until cache expiry.",
      "acceptanceCriteria": ["Provider failure remains distinguishable from a valid empty result", "Only accepted successful data is cached", "A regression test fails before and passes after the fix"],
      "designRefs": [], "dataContract": "Result type distinguishes success, empty success, and failure.",
      "expectations": {"security": "Errors expose no credentials.", "privacy": "No payload in logs.", "accessibility": "Failure message includes next action.", "analytics": "Outage is an operational error, not empty-result product telemetry."},
      "dependencies": ["SWAI-401", "SWAI-402"], "nonGoals": ["Changing providers"], "definitionOfDone": ["Regression test and production-like verification pass"], "evidence": ["Failing/passing test", "Root-cause explanation"], "concepts": ["cache", "error model", "regression test"], "seededBug": "Catch every adapter error and return an empty array, then cache that value. Learner must replace this with a typed failure path."
    },
    {
      "id": "SWAI-404", "type": "review", "priority": "P1", "epic": "API product release", "title": "Deploy and document provider operations", "persona": "Technical lead", "outcome": "The dashboard can be operated within provider limits and switched off safely.", "context": "Document local/preview/production configuration, rate-limit behavior, cost monitoring, cache rules, provider status response, and rollback.",
      "acceptanceCriteria": ["Production deployment is verified with synthetic use", "Runbook states credential ownership, limits, cost alert, cache/freshness, outage behavior, and disable/rollback steps", "README links the ADR and documents known limitations"],
      "designRefs": [], "dataContract": "Runbook and environment-variable inventory.",
      "expectations": {"security": "List variable names, never values.", "privacy": "Document retention.", "accessibility": "Known accessibility limitations explicit.", "analytics": "Cost and failure signals documented."},
      "dependencies": ["SWAI-403"], "nonGoals": ["24/7 SLA"], "definitionOfDone": ["Production and runbook evidence complete"], "evidence": ["Production URL", "Runbook", "Comprehension recording"], "concepts": ["environment", "operations", "cost control", "rollback"]
    }
  ]
}
